{
  "$schema": "../schemas/campaign.schema.json",
  "schemaVersion": 1,
  "packageVersion": "1.0.0",
  "id": "jp_tokugawa_sekigahara",
  "titleStringId": "campaign.sekigahara.title",
  "subtitleStringId": "campaign.sekigahara.subtitle",
  "playerFactionId": "eastern_coalition",
  "playerLeaderId": "tokugawa_ieyasu",
  "displayResourceNames": { "food": "resource.rice", "currency": "resource.treasury", "materials": "resource.materials", "authority": "resource.authority" },
  "historicalFrame": {
    "startYear": 1598,
    "endYear": 1600,
    "compressed": true,
    "finalePeriodDateStringId": "date.keicho5.month9.day15",
    "finaleGregorianStringId": "date.1600_10_21_gregorian",
    "disclosureStringId": "history.compression_disclosure"
  },
  "cast": [
    { "id": "tokugawa_ieyasu", "portraitAssetId": "PORTRAIT_IEYASU", "role": "leader" },
    { "id": "honda_tadakatsu", "portraitAssetId": "PORTRAIT_HONDA", "role": "military_adviser" },
    { "id": "ii_naomasa", "portraitAssetId": "PORTRAIT_II", "role": "field_commander" },
    { "id": "fukushima_masanori", "portraitAssetId": "PORTRAIT_FUKUSHIMA", "role": "coalition_commander" },
    { "id": "kuroda_nagamasa", "portraitAssetId": "PORTRAIT_KURODA", "role": "intelligence_adviser" },
    { "id": "ishida_mitsunari", "portraitAssetId": "PORTRAIT_ISHIDA", "role": "western_rival" },
    { "id": "otani_yoshitsugu", "portraitAssetId": "PORTRAIT_OTANI", "role": "western_commander" },
    { "id": "kobayakawa_hideaki", "portraitAssetId": "PORTRAIT_KOBAYAKAWA", "role": "uncertain_actor" }
  ],
  "startingState": {
    "resources": { "food": 720, "currency": 520, "materials": 360, "authority": 62 },
    "edo": {
      "estimatedHouseholds": 2400,
      "prosperity": 58,
      "publicOrder": 74,
      "defense": 58,
      "infrastructure": 44,
      "taxRatePercent": 20,
      "garrisonTroops": 800,
      "laborAllocation": { "farms": 2400, "workshops": 1440, "works": 960 }
    },
    "diplomacy": { "coalitionCohesion": 52, "kobayakawaCommitment": 42, "intelligence": 25 },
    "threats": { "uesugiPressure": 55, "westernMomentum": 48 },
    "playerArmy": {
      "locationId": "edo",
      "active": false,
      "readiness": 76,
      "campaignSupplyReserveRice": 0,
      "routeState": "unprepared",
      "formations": [
        { "id": "east_ii", "troops": 3200, "baseTroops": 3200, "morale": 82, "equipmentPoints": 0 },
        { "id": "east_fukushima", "troops": 3400, "baseTroops": 3400, "morale": 76, "equipmentPoints": 0 },
        { "id": "east_kuroda", "troops": 3000, "baseTroops": 3000, "morale": 78, "equipmentPoints": 0 }
      ]
    },
    "westernState": {
      "resources": { "food": 690, "currency": 500, "materials": 340, "authority": 58 },
      "momentum": 48,
      "administrativeQualityMinPerThousand": 750,
      "administrativeQualityMaxPerThousand": 900,
      "ordersPerWorldPhase": 2
    }
  },
  "map": {
    "nodes": [
      { "id": "edo", "type": "hub", "openingStatus": "player", "x": 520, "y": 220 },
      { "id": "oyama", "type": "council", "openingStatus": "neutral", "x": 462, "y": 164 },
      { "id": "aizu", "type": "pressure", "openingStatus": "uesugi", "x": 486, "y": 82 },
      { "id": "kiyosu", "type": "staging", "openingStatus": "eastern_ally", "x": 314, "y": 246 },
      { "id": "gifu", "type": "castle", "openingStatus": "western", "x": 272, "y": 218 },
      { "id": "ogaki", "type": "castle", "openingStatus": "western", "x": 242, "y": 236 },
      { "id": "sekigahara", "type": "battlefield", "openingStatus": "contested", "x": 218, "y": 225 },
      { "id": "fushimi", "type": "castle", "openingStatus": "tokugawa_garrison", "x": 174, "y": 292 },
      { "id": "osaka", "type": "political_center", "openingStatus": "toyotomi_seat", "x": 142, "y": 324 }
    ],
    "routes": [
      { "id": "route_edo_oyama", "a": "edo", "b": "oyama", "travelPoints": 3 },
      { "id": "route_oyama_aizu", "a": "oyama", "b": "aizu", "travelPoints": 4 },
      { "id": "route_edo_kiyosu", "a": "edo", "b": "kiyosu", "travelPoints": 7, "tag": "tokaido_abstraction" },
      { "id": "route_kiyosu_gifu", "a": "kiyosu", "b": "gifu", "travelPoints": 2 },
      { "id": "route_gifu_ogaki", "a": "gifu", "b": "ogaki", "travelPoints": 2 },
      { "id": "route_gifu_sekigahara", "a": "gifu", "b": "sekigahara", "travelPoints": 2 },
      { "id": "route_ogaki_sekigahara", "a": "ogaki", "b": "sekigahara", "travelPoints": 1 },
      { "id": "route_sekigahara_fushimi", "a": "sekigahara", "b": "fushimi", "travelPoints": 5 },
      { "id": "route_fushimi_osaka", "a": "fushimi", "b": "osaka", "travelPoints": 2 }
    ]
  },
  "chapters": [
    {
      "index": 1,
      "id": "balance_of_regents",
      "dateStringId": "chapter.1.date",
      "titleStringId": "chapter.1.title",
      "chronicleStringId": "chapter.1.chronicle",
      "eventAssetId": "EVENT_CH1_REGENTS",
      "policyChoices": [
        {
          "id": "c1_policy_granaries",
          "titleStringId": "policy.c1.granaries",
          "cost": { "food": 60 },
          "effects": [{ "path": "edo.publicOrder", "delta": 6 }, { "flag": "famine_weight_relief_active", "value": true }]
        },
        {
          "id": "c1_policy_stipends",
          "titleStringId": "policy.c1.stipends",
          "cost": { "currency": 70 },
          "effects": [{ "path": "diplomacy.coalitionCohesion", "delta": 6 }, { "path": "resources.authority", "delta": 3 }]
        },
        {
          "id": "c1_policy_reserves",
          "titleStringId": "policy.c1.reserves",
          "cost": {},
          "effects": [{ "path": "resources.currency", "delta": 25 }, { "path": "resources.authority", "delta": -2 }]
        }
      ],
      "orderIds": ["c1_labor_ledger", "c1_tax_register", "c1_repair_tokaido", "c1_court_letters", "audit_stores"],
      "milestoneEffects": [{ "path": "threats.westernMomentum", "delta": 6 }]
    },
    {
      "index": 2,
      "id": "aizu_question",
      "dateStringId": "chapter.2.date",
      "titleStringId": "chapter.2.title",
      "chronicleStringId": "chapter.2.chronicle",
      "eventAssetId": "EVENT_CH2_AIZU",
      "policyChoices": [
        {
          "id": "c2_policy_rapid",
          "titleStringId": "policy.c2.rapid",
          "cost": {},
          "effects": [
            { "path": "resources.authority", "delta": 4 },
            { "flag": "chapter2_route_supply_multiplier_per_thousand", "value": 1150 },
            { "path": "diplomacy.intelligence", "delta": -4 }
          ]
        },
        {
          "id": "c2_policy_guarded",
          "titleStringId": "policy.c2.guarded",
          "cost": { "food": 40 },
          "effects": [{ "path": "playerArmy.readiness", "delta": 5 }, { "path": "edo.defense", "delta": 3 }]
        },
        {
          "id": "c2_policy_delay",
          "titleStringId": "policy.c2.delay",
          "cost": {},
          "effects": [{ "path": "resources.authority", "delta": -5 }, { "path": "diplomacy.intelligence", "delta": 12 }, { "path": "threats.uesugiPressure", "delta": 8 }]
        }
      ],
      "orderIds": ["c2_march_provisions", "c2_reinforce_edo", "c2_muster_bands", "c2_secure_allies", "audit_stores"],
      "milestoneEffects": [
        { "path": "playerArmy.locationId", "set": "oyama" },
        { "path": "playerArmy.active", "set": true },
        { "path": "threats.westernMomentum", "delta": 10 },
        { "flag": "famine_weight_relief_active", "value": false }
      ]
    },
    {
      "index": 3,
      "id": "western_army_rises",
      "dateStringId": "chapter.3.date",
      "titleStringId": "chapter.3.title",
      "chronicleStringId": "chapter.3.chronicle",
      "eventAssetId": "EVENT_CH3_FUSHIMI",
      "openingEffects": [{ "nodeId": "fushimi", "status": "western" }, { "flag": "fushimi_fallen", "value": true }],
      "policyChoices": [
        {
          "id": "c3_policy_tokaido",
          "titleStringId": "policy.c3.tokaido",
          "cost": { "currency": 30 },
          "effects": [{ "path": "playerArmy.readiness", "delta": 4 }, { "flag": "main_force_tokaido", "value": true }]
        },
        {
          "id": "c3_policy_divide",
          "titleStringId": "policy.c3.divide",
          "cost": {},
          "effects": [
            { "path": "diplomacy.coalitionCohesion", "delta": 4 },
            { "path": "diplomacy.intelligence", "delta": 5 },
            { "flag": "hidetada_delay_risk", "value": true }
          ]
        },
        {
          "id": "c3_policy_consolidate",
          "titleStringId": "policy.c3.consolidate",
          "cost": {},
          "effects": [{ "path": "resources.food", "delta": 50 }, { "path": "threats.westernMomentum", "delta": 10 }, { "path": "playerArmy.readiness", "delta": 3 }]
        }
      ],
      "orderIds": ["c3_oyama_march", "c3_kiyosu_stores", "c3_secure_gifu", "c3_home_relief", "audit_stores"],
      "milestoneEffects": [{ "path": "playerArmy.locationId", "set": "kiyosu" }]
    },
    {
      "index": 4,
      "id": "roads_to_mino",
      "dateStringId": "chapter.4.date",
      "titleStringId": "chapter.4.title",
      "chronicleStringId": "chapter.4.chronicle",
      "eventAssetId": "EVENT_CH4_MINO",
      "policyChoices": [
        {
          "id": "c4_policy_quick_battle",
          "titleStringId": "policy.c4.quick",
          "cost": {},
          "effects": [{ "path": "threats.westernMomentum", "delta": -4 }, { "path": "playerArmy.readiness", "delta": 4 }, { "flag": "no_final_crisis_reroll", "value": true }]
        },
        {
          "id": "c4_policy_intelligence",
          "titleStringId": "policy.c4.intelligence",
          "cost": { "food": 50 },
          "effects": [{ "path": "diplomacy.intelligence", "delta": 12 }, { "path": "threats.westernMomentum", "delta": 5 }]
        },
        {
          "id": "c4_policy_homeland",
          "titleStringId": "policy.c4.homeland",
          "cost": {},